"item_id","root_name","disease_id","disease_name","calculated_dw","article_number","title","authors","pubmed","PMID","doi","DOI","pmc","PMCID","pubtypes","weight"
"41","Fruit Salad",35,"Coronary Disease",915,12,"No difference in lifestyle changes by adding individual counselling to group-based rehabilitation RCT among coronary heart disease patients.","Mildestvedt T, Meland E, Eide GE","https://pubmed.ncbi.nlm.nih.gov/17852978/","17852978","https://doi.org/10.1080/14034940701349241","10.1080/14034940701349241","No PMC available",,"Journal Article, Randomized Controlled Trial, Research Support, Non-U.S. Gov't",4
"41","Fruit Salad",35,"Coronary Disease",915,13,"The effect of dietary patterns on estimated coronary heart disease risk: results from the Dietary Approaches to Stop Hypertension (DASH) trial.","Chen ST, Maruthur NM, Appel LJ","https://pubmed.ncbi.nlm.nih.gov/20807884/","20807884","https://doi.org/10.1161/CIRCOUTCOMES.109.930685","10.1161/CIRCOUTCOMES.109.930685","https://www.ncbi.nlm.nih.gov/pmc/articles/PMC3005367/","PMC3005367","Journal Article, Randomized Controlled Trial, Research Support, N.I.H., Extramural, Research Support, Non-U.S. Gov't",4
"41","Fruit Salad",35,"Coronary Disease",915,14,"The effects of a lifestyle-focused text-messaging intervention on adherence to dietary guideline recommendations in patients with coronary heart disease: an analysis of the TEXT ME study.","Santo K, Hyun K, de Keizer L, Thiagalingam A, Hillis GS, Chalmers J, Redfern J, Chow CK","https://pubmed.ncbi.nlm.nih.gov/29792202/","29792202","https://doi.org/10.1186/s12966-018-0677-1","10.1186/s12966-018-0677-1","https://www.ncbi.nlm.nih.gov/pmc/articles/PMC5967045/","PMC5967045","Journal Article, Randomized Controlled Trial, Research Support, Non-U.S. Gov't",4
"41","Fruit Salad",35,"Coronary Disease",915,15,"Success in Achieving the Targets of the 20-Year Infancy-Onset Dietary Intervention: Association With Insulin Sensitivity and Serum Lipids.","Laitinen TT, Nuotio J, Juonala M, Niinikoski H, Rovio S, Viikari JSA, Rönnemaa T, Magnussen CG, Jokinen E, Lagström H, Jula A, Simell O, Raitakari OT, Pahkala K","https://pubmed.ncbi.nlm.nih.gov/30072407/","30072407","https://doi.org/10.2337/dc18-0869","10.2337/dc18-0869","No PMC available",,"Journal Article, Randomized Controlled Trial, Research Support, Non-U.S. Gov't",4
"41","Fruit Salad",35,"Coronary Disease",915,16,"Longitudinal effect of 20-year infancy-onset dietary intervention on food consumption and nutrient intake: the randomized controlled STRIP study.","Matthews LA, Rovio SP, Jaakkola JM, Niinikoski H, Lagström H, Jula A, Viikari JSA, Rönnemaa T, Simell O, Raitakari OT, Pahkala K","https://pubmed.ncbi.nlm.nih.gov/30397257/","30397257","https://doi.org/10.1038/s41430-018-0350-4","10.1038/s41430-018-0350-4","No PMC available",,"Journal Article, Randomized Controlled Trial, Research Support, Non-U.S. Gov't",4
"41","Fruit Salad",35,"Coronary Disease",915,17,"[Comparative evaluation of nutrition of healthy persons, patients with the preclinical stage of ischemic heart disease and in patients with marked coronary disease].","Aronov DM, Eganian RA, Kovaleva OF, Zhidko NI, Dannelov GE, Rozhnov AV, Shcherbakova IA","https://pubmed.ncbi.nlm.nih.gov/1921132/","1921132","No DOI available",,"No PMC available",,"Comparative Study, Journal Article",3
"41","Fruit Salad",35,"Coronary Disease",915,18,"[Modifying increased plasma cholesterol levels in secondary prevention of coronary heart disease].","Jost S, Lichtlen PR","https://pubmed.ncbi.nlm.nih.gov/7571764/","7571764","No DOI available",,"No PMC available",,"Comparative Study, English Abstract, Journal Article, Research Support, Non-U.S. Gov't, Review",3
"41","Fruit Salad",35,"Coronary Disease",915,19,"Do hydroxy-carotenoids prevent coronary heart disease? A comparison between Belfast and Toulouse.","Howard AN, Williams NR, Palmer CR, Cambou JP, Evans AE, Foote JW, Marques-Vidal P, McCrum EE, Ruidavets JB, Nigdikar SV, Rajput-Williams J, Thurnham DI","https://pubmed.ncbi.nlm.nih.gov/8843985/","8843985","No DOI available",,"No PMC available",,"Comparative Study, Journal Article, Multicenter Study, Research Support, Non-U.S. Gov't",3
"41","Fruit Salad",35,"Coronary Disease",915,20,"Dietary patterns and the risk of coronary heart disease among Jordanians: A case-control study.","Tayyem RF, Al-Shudifat AE, Johannessen A, Bawadi HA, AbuMweis SS, Agraib LM, Allhedan SS, Haj-Husein I, Azab M","https://pubmed.ncbi.nlm.nih.gov/29237548/","29237548","https://doi.org/10.1016/j.numecd.2017.10.026","10.1016/j.numecd.2017.10.026","No PMC available",,"Comparative Study, Journal Article",3
"41","Fruit Salad",35,"Coronary Disease",915,21,"Potential and limitations of health policy to improve coronary heart disease prevention and to reduce the burden of disease: A Russian experience.","Pogosova N, Oganov R, Saner H, Suvorov S, Sokolova O","https://pubmed.ncbi.nlm.nih.gov/29635927/","29635927","https://doi.org/10.1177/2047487318768030","10.1177/2047487318768030","No PMC available",,"Journal Article, Multicenter Study",3
"41","Fruit Salad",35,"Coronary Disease",915,22,"Dyslipoproteinemia in the elderly. Special considerations.","Luepker RV","https://pubmed.ncbi.nlm.nih.gov/2192881/","2192881","No DOI available",,"No PMC available",,"Journal Article, Review",2
"41","Fruit Salad",35,"Coronary Disease",915,23,"Dietary fiber and health. AMA council on Scientific Affairs.","","https://pubmed.ncbi.nlm.nih.gov/2558005/","2558005","No DOI available",,"No PMC available",,"Journal Article, Review",2
"41","Fruit Salad",35,"Coronary Disease",915,24,"Traditional Greek diet and coronary heart disease.","Trichopoulou A, Lagiou P, Trichopoulos D","https://pubmed.ncbi.nlm.nih.gov/7614424/","7614424","No DOI available",,"No PMC available",,"Journal Article, Research Support, Non-U.S. Gov't, Review",2
"41","Fruit Salad",35,"Coronary Disease",915,25,"Diet and coronary heart disease--a review.","Hughes K","https://pubmed.ncbi.nlm.nih.gov/7653964/","7653964","No DOI available",,"No PMC available",,"Journal Article, Review",2
"41","Fruit Salad",35,"Coronary Disease",915,26,"Insights into the pathogenesis and prevention of coronary artery disease.","O'Keefe JH Jr, Lavie CJ Jr, McCallister BD","https://pubmed.ncbi.nlm.nih.gov/7808056/","7808056","https://doi.org/10.1016/S0025-6196(11)64669-7","10.1016/S0025-6196(11)64669-7","No PMC available",,"Journal Article, Review",2
"41","Fruit Salad",35,"Coronary Disease",915,27,"Diet and health: what should we eat?","Willett WC","https://pubmed.ncbi.nlm.nih.gov/8160011/","8160011","https://doi.org/10.1126/science.8160011","10.1126/science.8160011","No PMC available",,"Journal Article, Review",2
"41","Fruit Salad",35,"Coronary Disease",915,28,"What accounts for the association of vegetables and fruits with lower incidence of cancers and coronary heart disease?","Omenn GS","https://pubmed.ncbi.nlm.nih.gov/8520718/","8520718","https://doi.org/10.1016/1047-2797(95)90014-4","10.1016/1047-2797(95)90014-4","No PMC available",,"Comment, Editorial, Research Support, U.S. Gov't, P.H.S., Review",2
"41","Fruit Salad",35,"Coronary Disease",915,29,"Cost-effectiveness analysis in diagnosis of cardiac disease: overview of its rationale and method.","Patterson RE","https://pubmed.ncbi.nlm.nih.gov/8799253/","8799253","https://doi.org/10.1016/s1071-3581(96)90094-x","10.1016/s1071-3581(96)90094-x","No PMC available",,"Journal Article, Review",2
"41","Fruit Salad",35,"Coronary Disease",915,30,"Wine as a biological fluid: history, production, and role in disease prevention.","Soleas GJ, Diamandis EP, Goldberg DM","https://pubmed.ncbi.nlm.nih.gov/9292395/","9292395","https://doi.org/10.1002/(SICI)1098-2825(1997)11:5&#x0003c;287::AID-JCLA6&#x0003e;3.0.CO;2-4","10.1002/(SICI)1098-2825(1997)11:5&#x0003c;287::AID-JCLA6&#x0003e;3.0.CO;2-4","https://www.ncbi.nlm.nih.gov/pmc/articles/PMC6760744/","PMC6760744","Historical Article, Journal Article, Review",2
"41","Fruit Salad",35,"Coronary Disease",915,31,"Healthy traditional Mediterranean diet: an expression of culture, history, and lifestyle.","Trichopoulou A, Lagiou P","https://pubmed.ncbi.nlm.nih.gov/9420448/","9420448","https://doi.org/10.1111/j.1753-4887.1997.tb01578.x","10.1111/j.1753-4887.1997.tb01578.x","No PMC available",,"Journal Article, Review",2
"41","Fruit Salad",35,"Coronary Disease",915,32,"Vitamin E and coronary artery disease.","Spencer AP, Carson DS, Crouch MA","https://pubmed.ncbi.nlm.nih.gov/10386507/","10386507","https://doi.org/10.1001/archinte.159.12.1313","10.1001/archinte.159.12.1313","No PMC available",,"Journal Article, Review",2
"41","Fruit Salad",35,"Coronary Disease",915,33,"Impact of nondigestible carbohydrates on serum lipoproteins and risk for cardiovascular disease.","Anderson JW, Hanna TJ","https://pubmed.ncbi.nlm.nih.gov/10395621/","10395621","https://doi.org/10.1093/jn/129.7.1457S","10.1093/jn/129.7.1457S","No PMC available",,"Journal Article, Review",2
"41","Fruit Salad",35,"Coronary Disease",915,34,"[Disease prevention by vitamins based on epidemiological investigations in humans].","Hirohata T","https://pubmed.ncbi.nlm.nih.gov/10540893/","10540893","No DOI available",,"No PMC available",,"English Abstract, Journal Article, Review",2
"41","Fruit Salad",35,"Coronary Disease",915,35,"Vegetarian diet: panacea for modern lifestyle diseases?","Segasothy M, Phillips PA","https://pubmed.ncbi.nlm.nih.gov/10627874/","10627874","https://doi.org/10.1093/qjmed/92.9.531","10.1093/qjmed/92.9.531","No PMC available",,"Journal Article, Review",2
"41","Fruit Salad",35,"Coronary Disease",915,36,"The health benefits of wine.","German JB, Walzem RL","https://pubmed.ncbi.nlm.nih.gov/10940346/","10940346","https://doi.org/10.1146/annurev.nutr.20.1.561","10.1146/annurev.nutr.20.1.561","No PMC available",,"Journal Article, Review",2
"41","Fruit Salad",35,"Coronary Disease",915,37,"Relationships among diet, physical activity and other lifestyle factors and debilitating diseases in the elderly.","Woo J","https://pubmed.ncbi.nlm.nih.gov/11041086/","11041086","https://doi.org/10.1038/sj.ejcn.1601036","10.1038/sj.ejcn.1601036","No PMC available",,"Journal Article, Review",2
"41","Fruit Salad",35,"Coronary Disease",915,38,"The effects of plant flavonoids on mammalian cells: implications for inflammation, heart disease, and cancer.","Middleton E Jr, Kandaswami C, Theoharides TC","https://pubmed.ncbi.nlm.nih.gov/11121513/","11121513","No DOI available",,"No PMC available",,"Journal Article, Research Support, Non-U.S. Gov't, Review",2
"41","Fruit Salad",35,"Coronary Disease",915,39,"Prevention of cancer and other chronic diseases worldwide based on sound mechanisms.","Weisburger JH","https://pubmed.ncbi.nlm.nih.gov/11216509/","11216509","https://doi.org/10.1002/biof.5520120112","10.1002/biof.5520120112","No PMC available",,"Journal Article, Research Support, Non-U.S. Gov't, Review",2
"41","Fruit Salad",35,"Coronary Disease",915,40,"Mediterranean diet and longevity.","Trichopoulou A, Vasilopoulou E","https://pubmed.ncbi.nlm.nih.gov/11242471/","11242471","https://doi.org/10.1079/096582197388554","10.1079/096582197388554","No PMC available",,"Journal Article, Review",2
"41","Fruit Salad",35,"Coronary Disease",915,41,"Alcohol and mortality: if you drink, do not forget fruits and vegetables.","Suter PM","https://pubmed.ncbi.nlm.nih.gov/11570433/","11570433","https://doi.org/10.1111/j.1753-4887.2001.tb07020.x","10.1111/j.1753-4887.2001.tb07020.x","No PMC available",,"Journal Article, Review",2
"41","Fruit Salad",35,"Coronary Disease",915,42,"Coronary heart disease: dietary links and pathogenesis.","Renaud S, Lanzmann-Petithory D","https://pubmed.ncbi.nlm.nih.gov/11683541/","11683541","https://doi.org/10.1079/phn2001134","10.1079/phn2001134","No PMC available",,"Journal Article, Research Support, Non-U.S. Gov't, Review",2
"41","Fruit Salad",35,"Coronary Disease",915,43,"Vitamin E supplementation in the prevention of coronary heart disease.","Pruthi S, Allison TG, Hensrud DD","https://pubmed.ncbi.nlm.nih.gov/11702901/","11702901","https://doi.org/10.4065/76.11.1131","10.4065/76.11.1131","No PMC available",,"Journal Article, Review",2
"41","Fruit Salad",35,"Coronary Disease",915,44,"Dietary flavonoids and risk of coronary heart disease.","Mojzisová G, Kuchta M","https://pubmed.ncbi.nlm.nih.gov/11829313/","11829313","No DOI available",,"No PMC available",,"Journal Article, Review",2
"41","Fruit Salad",35,"Coronary Disease",915,45,"Potential health benefits from the flavonoids in grape products on vascular disease.","Folts JD","https://pubmed.ncbi.nlm.nih.gov/12083471/","12083471","https://doi.org/10.1007/978-1-4757-5235-9_9","10.1007/978-1-4757-5235-9_9","No PMC available",,"Journal Article, Review",2
"41","Fruit Salad",35,"Coronary Disease",915,46,"Dietary glycemic load and atherothrombotic risk.","Liu S, Willett WC","https://pubmed.ncbi.nlm.nih.gov/12361493/","12361493","https://doi.org/10.1007/s11883-002-0050-2","10.1007/s11883-002-0050-2","No PMC available",,"Journal Article, Review",2
"41","Fruit Salad",35,"Coronary Disease",915,47,"Diet and prevention of coronary heart disease in the Arab Middle East countries.","Musaiger AO","https://pubmed.ncbi.nlm.nih.gov/12444306/","12444306","https://doi.org/10.1159/000066415","10.1159/000066415","No PMC available",,"Journal Article, Review",2
"41","Fruit Salad",35,"Coronary Disease",915,48,"[Folic acid fortified food and their importance in health promotion].","Kunachowicz H, Nadolna I, Stoś K, Brozek A, Szponar L","https://pubmed.ncbi.nlm.nih.gov/15230103/","15230103","No DOI available",,"No PMC available",,"English Abstract, Journal Article, Review",2
"41","Fruit Salad",35,"Coronary Disease",915,49,"Dietary recommendations in the prevention and treatment of coronary heart disease: do we have the ideal diet yet?","Chahoud G, Aude YW, Mehta JL","https://pubmed.ncbi.nlm.nih.gov/15541241/","15541241","https://doi.org/10.1016/j.amjcard.2004.07.109","10.1016/j.amjcard.2004.07.109","No PMC available",,"Journal Article, Review",2
"41","Fruit Salad",35,"Coronary Disease",915,50,"Health effects of phytoestrogens.","Branca F, Lorenzetti S","https://pubmed.ncbi.nlm.nih.gov/15702593/","15702593","https://doi.org/10.1159/000083773","10.1159/000083773","No PMC available",,"Journal Article, Review",2
"41","Fruit Salad",35,"Coronary Disease",915,51,"Does alpha-linolenic acid intake reduce the risk of coronary heart disease? A review of the evidence.","Mozaffarian D","https://pubmed.ncbi.nlm.nih.gov/15945135/","15945135","No DOI available",,"No PMC available",,"Journal Article, Research Support, N.I.H., Extramural, Research Support, Non-U.S. Gov't, Research Support, U.S. Gov't, P.H.S., Review",2
"41","Fruit Salad",35,"Coronary Disease",915,52,"Reducing hypertensive cardiovascular disease risk of African Americans with diet: focus on the facts.","Reusser ME, McCarron DA","https://pubmed.ncbi.nlm.nih.gov/16549487/","16549487","https://doi.org/10.1093/jn/136.4.1099","10.1093/jn/136.4.1099","No PMC available",,"Journal Article, Review",2
"41","Fruit Salad",35,"Coronary Disease",915,53,"What should we eat? Evidence from observational studies.","Adams SM, Standridge JB","https://pubmed.ncbi.nlm.nih.gov/16866057/","16866057","https://doi.org/10.1097/01.smj.0000220887.52952.f0","10.1097/01.smj.0000220887.52952.f0","No PMC available",,"Journal Article, Review",2
"41","Fruit Salad",35,"Coronary Disease",915,54,"The effects of macronutrients on blood pressure and lipids: an overview of the DASH and OmniHeart trials.","Miller ER 3rd, Erlinger TP, Appel LJ","https://pubmed.ncbi.nlm.nih.gov/17045071/","17045071","https://doi.org/10.1007/s11883-006-0020-1","10.1007/s11883-006-0020-1","No PMC available",,"Journal Article, Review",2
"41","Fruit Salad",35,"Coronary Disease",915,55,"Plant-based diets and control of lipids and coronary heart disease risk.","Rao V, Al-Weshahy A","https://pubmed.ncbi.nlm.nih.gov/18937895/","18937895","https://doi.org/10.1007/s11883-008-0075-2","10.1007/s11883-008-0075-2","No PMC available",,"Journal Article, Review",2
"41","Fruit Salad",35,"Coronary Disease",915,56,"Diet and lifestyle measures to protect the ageing heart.","Stanner S","https://pubmed.ncbi.nlm.nih.gov/19421086/","19421086","https://doi.org/10.12968/bjcn.2009.14.5.42080","10.12968/bjcn.2009.14.5.42080","No PMC available",,"Journal Article, Review",2
"41","Fruit Salad",35,"Coronary Disease",915,57,"Diet and lifestyle influences on risk of coronary heart disease.","Hu FB","https://pubmed.ncbi.nlm.nih.gov/19500488/","19500488","https://doi.org/10.1007/s11883-009-0040-8","10.1007/s11883-009-0040-8","No PMC available",,"Journal Article, Review",2
"41","Fruit Salad",35,"Coronary Disease",915,58,"Fruits, vegetables and coronary heart disease.","Dauchet L, Amouyel P, Dallongeville J","https://pubmed.ncbi.nlm.nih.gov/19652655/","19652655","https://doi.org/10.1038/nrcardio.2009.131","10.1038/nrcardio.2009.131","No PMC available",,"Journal Article, Review",2
"41","Fruit Salad",35,"Coronary Disease",915,59,"Nutritional recommendations for preventing coronary heart disease in women: evidence concerning whole foods and supplements.","Eilat-Adar S, Goldbourt U","https://pubmed.ncbi.nlm.nih.gov/20554172/","20554172","https://doi.org/10.1016/j.numecd.2010.01.011","10.1016/j.numecd.2010.01.011","No PMC available",,"Journal Article, Review",2
"41","Fruit Salad",35,"Coronary Disease",915,60,"Botanical flavonoids on coronary heart disease.","Wang CZ, Mehendale SR, Calway T, Yuan CS","https://pubmed.ncbi.nlm.nih.gov/21721147/","21721147","https://doi.org/10.1142/S0192415X1100910X","10.1142/S0192415X1100910X","https://www.ncbi.nlm.nih.gov/pmc/articles/PMC3277260/","PMC3277260","Journal Article, Research Support, N.I.H., Extramural, Review",2
"41","Fruit Salad",35,"Coronary Disease",915,61,"Dietary recommendations to prevent coronary heart disease.","Brown WV","https://pubmed.ncbi.nlm.nih.gov/2174214/","2174214","https://doi.org/10.1111/j.1749-6632.1990.tb42308.x","10.1111/j.1749-6632.1990.tb42308.x","No PMC available",,"Journal Article",0
"41","Fruit Salad",35,"Coronary Disease",915,62,"Trends in CHD in the United States.","Higgins M, Thom T","https://pubmed.ncbi.nlm.nih.gov/2807708/","2807708","No DOI available",,"No PMC available",,"Journal Article",0
"41","Fruit Salad",35,"Coronary Disease",915,63,"Changes in the dietary habits of male workers in Warsaw plants over a period of four years.","Kulesza W, Rywik S, Chwojnowska Z, Radzanowska J, Marczuk A","https://pubmed.ncbi.nlm.nih.gov/6881959/","6881959","https://doi.org/10.1016/s0195-6663(83)80044-0","10.1016/s0195-6663(83)80044-0","No PMC available",,"Journal Article",0
"41","Fruit Salad",35,"Coronary Disease",915,64,"A preliminary study of potential dietary risk factors for coronary heart disease among Chinese American adolescents.","Sun WY, Chen WW","https://pubmed.ncbi.nlm.nih.gov/7877278/","7877278","https://doi.org/10.1111/j.1746-1561.1994.tb06207.x","10.1111/j.1746-1561.1994.tb06207.x","No PMC available",,"Journal Article",0
"41","Fruit Salad",35,"Coronary Disease",915,65,"[Phenolic acid intake of adults in a Bavarian subgroup of the national food consumption survey].","Radtke J, Linseisen J, Wolfram G","https://pubmed.ncbi.nlm.nih.gov/9698647/","9698647","https://doi.org/10.1007/s003940050016","10.1007/s003940050016","No PMC available",,"English Abstract, Journal Article",0
"41","Fruit Salad",35,"Coronary Disease",915,66,"Frequent nut consumption and risk of coronary heart disease in women: prospective cohort study.","Hu FB, Stampfer MJ, Manson JE, Rimm EB, Colditz GA, Rosner BA, Speizer FE, Hennekens CH, Willett WC","https://pubmed.ncbi.nlm.nih.gov/9812929/","9812929","https://doi.org/10.1136/bmj.317.7169.1341","10.1136/bmj.317.7169.1341","https://www.ncbi.nlm.nih.gov/pmc/articles/PMC28714/","PMC28714","Journal Article, Research Support, U.S. Gov't, P.H.S.",0
"41","Fruit Salad",35,"Coronary Disease",915,67,"[Carotenoid intake in the German National Food Consumption Survey].","Pelz R, Schmidt-Faber B, Heseker H","https://pubmed.ncbi.nlm.nih.gov/9894680/","9894680","https://doi.org/10.1007/s003940050032","10.1007/s003940050032","No PMC available",,"English Abstract, Journal Article",0
"41","Fruit Salad",35,"Coronary Disease",915,68,"The effect of fruit and vegetable intake on risk for coronary heart disease.","Joshipura KJ, Hu FB, Manson JE, Stampfer MJ, Rimm EB, Speizer FE, Colditz G, Ascherio A, Rosner B, Spiegelman D, Willett WC","https://pubmed.ncbi.nlm.nih.gov/11412050/","11412050","https://doi.org/10.7326/0003-4819-134-12-200106190-00010","10.7326/0003-4819-134-12-200106190-00010","No PMC available",,"Journal Article, Research Support, Non-U.S. Gov't, Research Support, U.S. Gov't, P.H.S.",0
"41","Fruit Salad",35,"Coronary Disease",915,69,"Summaries for patients. Eating fruits and vegetables helps prevent coronary heart disease.","","https://pubmed.ncbi.nlm.nih.gov/11419416/","11419416","https://doi.org/10.7326/0003-4819-134-12-200106190-00005","10.7326/0003-4819-134-12-200106190-00005","No PMC available",,"Journal Article",0
"41","Fruit Salad",35,"Coronary Disease",915,70,"The stages of change for dietary fat and fruit and vegetable intake of patients at the outset of a cardiac rehabilitation program.","Frame CJ, Green CG, Herr DG, Myers JE, Taylor ML","https://pubmed.ncbi.nlm.nih.gov/11523497/","11523497","https://doi.org/10.4278/0890-1171-15.6.405","10.4278/0890-1171-15.6.405","No PMC available",,"Journal Article, Research Support, Non-U.S. Gov't",0
"41","Fruit Salad",35,"Coronary Disease",915,71,"[Lipid and lipoprotein profile of Chinese immigrants living in Costa Rica].","Holst I, Monge-Rojas R, Marín RM, Hidalgo K, Kelly M","https://pubmed.ncbi.nlm.nih.gov/12448340/","12448340","No DOI available",,"No PMC available",,"Journal Article, Research Support, Non-U.S. Gov't",0
"41","Fruit Salad",35,"Coronary Disease",915,72,"Recommendations by health organizations for pulse consumption.","Leterme P","https://pubmed.ncbi.nlm.nih.gov/12498622/","12498622","https://doi.org/10.1079/BJN2002712","10.1079/BJN2002712","No PMC available",,"Journal Article",0
"41","Fruit Salad",35,"Coronary Disease",915,73,"Dietary intake and risk of coronary heart disease differ among ethnic subgroups of black Americans.","Lancaster KJ, Watts SO, Dixon LB","https://pubmed.ncbi.nlm.nih.gov/16424126/","16424126","https://doi.org/10.1093/jn/136.2.446","10.1093/jn/136.2.446","No PMC available",,"Journal Article",0
"41","Fruit Salad",35,"Coronary Disease",915,74,"Dietary habits, plasma polyunsaturated fatty acids and selected coronary disease risk factors in Tanzania.","Njelekela M, Ikeda K, Mtabaji J, Yamori Y","https://pubmed.ncbi.nlm.nih.gov/16463751/","16463751","https://doi.org/10.4314/eamj.v82i11.9412","10.4314/eamj.v82i11.9412","No PMC available",,"Journal Article, Research Support, Non-U.S. Gov't",0
"41","Fruit Salad",35,"Coronary Disease",915,75,"Health benefits of nuts: potential role of antioxidants.","Blomhoff R, Carlsen MH, Andersen LF, Jacobs DR Jr","https://pubmed.ncbi.nlm.nih.gov/17125534/","17125534","https://doi.org/10.1017/bjn20061864","10.1017/bjn20061864","No PMC available",,"Journal Article, Research Support, Non-U.S. Gov't",0
"41","Fruit Salad",35,"Coronary Disease",915,76,"Fruit and vegetable intake and the risk for developing coronary heart disease.","Nikolić M, Nikić D, Petrović B","https://pubmed.ncbi.nlm.nih.gov/18459474/","18459474","https://doi.org/10.21101/cejph.a3442","10.21101/cejph.a3442","No PMC available",,"Journal Article",0
"41","Fruit Salad",35,"Coronary Disease",915,77,"Session 4: CVD, diabetes and cancer: Evidence for the use of the Mediterranean diet in patients with CHD.","McKeown PP, Logan K, McKinley MC, Young IS, Woodside JV","https://pubmed.ncbi.nlm.nih.gov/20003638/","20003638","https://doi.org/10.1017/S0029665109991856","10.1017/S0029665109991856","No PMC available",,"Journal Article",0
"41","Fruit Salad",35,"Coronary Disease",915,78,"Lifestyle behaviors associated with secondary prevention of coronary heart disease among California adults.","Bellow A, Epstein JF, Parikh-Patel A","https://pubmed.ncbi.nlm.nih.gov/21324245/","21324245","No DOI available",,"https://www.ncbi.nlm.nih.gov/pmc/articles/PMC3073424/","PMC3073424","Journal Article, Research Support, U.S. Gov't, P.H.S.",0
"41","Fruit Salad",35,"Coronary Disease",915,79,"Mediterranean diet and CHD: the Greek European Prospective Investigation into Cancer and Nutrition cohort.","Dilis V, Katsoulis M, Lagiou P, Trichopoulos D, Naska A, Trichopoulou A","https://pubmed.ncbi.nlm.nih.gov/22894912/","22894912","https://doi.org/10.1017/S0007114512001821","10.1017/S0007114512001821","No PMC available",,"Journal Article, Research Support, Non-U.S. Gov't",0
"41","Fruit Salad",35,"Coronary Disease",915,80,"Healthful and Unhealthful Plant-Based Diets and the Risk of Coronary Heart Disease in U.S. Adults.","Satija A, Bhupathiraju SN, Spiegelman D, Chiuve SE, Manson JE, Willett W, Rexrode KM, Rimm EB, Hu FB","https://pubmed.ncbi.nlm.nih.gov/28728684/","28728684","https://doi.org/10.1016/j.jacc.2017.05.047","10.1016/j.jacc.2017.05.047","https://www.ncbi.nlm.nih.gov/pmc/articles/PMC5555375/","PMC5555375","Journal Article",0
"41","Fruit Salad",35,"Coronary Disease",915,81,"CHD Risk Minimization through Lifestyle Control: Machine Learning Gateway.","He X, Matam BR, Bellary S, Ghosh G, Chattopadhyay AK","https://pubmed.ncbi.nlm.nih.gov/32139725/","32139725","https://doi.org/10.1038/s41598-020-60786-w","10.1038/s41598-020-60786-w","https://www.ncbi.nlm.nih.gov/pmc/articles/PMC7058059/","PMC7058059","Journal Article",0
